date,user,text
2023-10-01,Priyanka,"I am working on a new project: 'Establish Kathak Dance Academy' with a due date of 2024-06-01. It’s a high priority for me."
2023-10-02,Priyanka,"I have to practice Kathak today for 2 hours to refine the 'Tatkaar' steps."
2023-10-03,Priyanka,"I plan to meet with the Indian community in San Jose on 2023-10-10 at 5 PM to discuss the dance academy."
2023-10-04,Priyanka,"I added a routine activity: 'Morning stretching and dance warm-up' starting every Monday from 2023-10-09."
2023-10-05,Priyanka,"I am planning to attend a Kathak workshop in San Francisco on 2023-10-15 at 10 AM."
2023-10-06,Priyanka,"I updated the dance academy project: I finalized the location for the academy."
2023-10-07,Priyanka,"I have an appointment with a potential dance instructor on 2023-10-12 at 3 PM at the community center."
2023-10-08,Priyanka,"I plan to teach a Kathak class tomorrow at 6 PM for the local community."
2023-10-09,Priyanka,"I need to research traditional Kathak costumes by 2023-10-20."
2023-10-10,Priyanka,"I updated the dance academy project: I received positive feedback from the community meeting."
2023-10-11,Priyanka,"I plan to visit a dance supply store in San Jose on 2023-10-14 at 11 AM."
2023-10-12,Priyanka,"I have to create a brochure for the dance academy by 2023-10-25."
2023-10-13,Priyanka,"I will practice the 'Chakkars' (spins) today for 1 hour."
2023-10-14,Priyanka,"I updated the dance academy project: I finalized the brochure design."
2023-10-15,Priyanka,"I attended the Kathak workshop in San Francisco and took notes on new techniques."
2023-10-16,Priyanka,"I added a routine activity: 'Evening meditation and dance reflection' starting every Wednesday from 2023-10-18."
2023-10-17,Priyanka,"I plan to meet with a local artist on 2023-10-20 at 4 PM to discuss collaboration for the academy."
2023-10-18,Priyanka,"I updated the dance academy project: I started the registration process for students."
2023-10-19,Priyanka,"I plan to attend a cultural event in San Jose on 2023-10-22 at 7 PM."
2023-10-20,Priyanka,"I met with the local artist and discussed potential mural designs for the academy."
2023-10-21,Priyanka,"I need to organize a Kathak performance for the community by 2023-11-10."
2023-10-22,Priyanka,"I attended the cultural event and networked with potential sponsors for the academy."
2023-10-23,Priyanka,"I plan to practice the 'Abhinaya' (expressions) tomorrow for 1.5 hours."
2023-10-24,Priyanka,"I updated the dance academy project: I received initial funding from a sponsor."
2023-10-25,Priyanka,"I completed the brochure for the dance academy and distributed it in the community."
2023-10-26,Priyanka,"I need to plan a Kathak workshop for children by 2023-11-15."
2023-10-27,Priyanka,"I plan to visit a dance school in Los Angeles on 2023-11-05 to gather ideas."
2023-10-28,Priyanka,"I updated the dance academy project: I finalized the curriculum for beginners."
2023-10-29,Priyanka,"I plan to meet with a dance historian on 2023-11-01 at 2 PM to discuss the history of Kathak."
2023-10-30,Priyanka,"I added a routine activity: 'Weekly review of dance progress' starting every Sunday from 2023-11-05."x